{
  "description": "",
  "frameworks": [
    {
      "href": "https://atlas.mitre.org/tactics/AML.TA0006",
      "id": "AML.TA0006",
      "title": "MITRE ATLAS"
    },
    {
      "href": "https://attack.mitre.org/tactics/TA0003/",
      "id": "TA0003",
      "title": "MITRE ATT&CK"
    }
  ],
  "summary": "Keep your malicious prompt there for future conversations",
  "tactic_order": 5,
  "title": "Persistence"
}
