{
    "tactic_order": 7,
    "title": "Defense Evasion",
    "summary": "The adversary is trying to avoid being detected by security software and native controls.",
    "description": "",
    "frameworks": [
        {"title": "MITRE ATLAS", "id": "AML.TA0007", "href": "https://atlas.mitre.org/tactics/AML.TA0007"},
        {"title": "MITRE ATT&CK", "id": "TA0005", "href": "https://attack.mitre.org/tactics/TA0005/"}
    ]
}