{
    "tactic_order": 9,
    "title": "Discovery",
    "summary": "Understand the capabilities and mitigations in place.",
    "description": "",
    "frameworks": [
        {"title": "MITRE ATLAS", "id": "AML.TA0008", "href": "https://atlas.mitre.org/tactics/AML.TA0008"},
        {"title": "MITRE ATT&CK", "id": "TA0007", "href": "https://attack.mitre.org/tactics/TA0007/"}
    ]
}