{
  "description": "",
  "frameworks": [
    {
      "href": "https://atlas.mitre.org/tactics/AML.TA0003",
      "id": "AML.TA0005",
      "title": "MITRE ATLAS"
    },
    {
      "href": "https://attack.mitre.org/tactics/TA0042/",
      "id": "TA0042",
      "title": "MITRE ATT&CK"
    }
  ],
  "summary": "The adversary is trying to establish resources they can use to support operations.",
  "tactic_order": 2,
  "title": "Resource Development"
}
