{
    "tactic_order": 8,
    "title": "Credential Access",
    "summary": "The adversary is trying to steal account names and passwords.",
    "description": "",
    "frameworks": [
        {"title": "MITRE ATLAS", "id": "AML.TA0013", "href": "https://atlas.mitre.org/tactics/AML.TA0013"},
        {"title": "MITRE ATT&CK", "id": "TA0006", "href": "https://attack.mitre.org/tactics/TA0006/"}
    ]
}