{
    "tactic_order": 3,
    "title": "Initial Access",
    "summary": "Get your text into the LLM prompt",
    "description": "",
    "frameworks": [
        {"title": "MITRE ATLAS", "id": "AML.TA0004", "href": "https://atlas.mitre.org/tactics/AML.TA0004"},
        {"title": "MITRE ATT&CK", "id": "TA0001", "href": "https://attack.mitre.org/tactics/TA0001/"}
    ]
}